{
  "contract_version": "context-v1",
  "artifact_kind": "context",
  "status": "completed_clean",
  "comparison_status": "not_comparable",
  "schema_version": 3,
  "evidence": "incomplete",
  "execution_policy": {
    "mode": "cargo_check",
    "workspace_trust": "required",
    "cargo_registry_network": "offline",
    "process_network_isolation": "not_enforced",
    "environment": "allowlist",
    "compiler_wrappers": "disabled",
    "target_directory": "dedicated_temp"
  },
  "workspace": {},
  "changed_files": [],
  "diagnostics": {
    "producer": "cargo_check",
    "profile": "cargo_check_v1",
    "producer_version": "rustc 1.85.0",
    "comparison_basis": {
      "workspace_members_sha256": "sha256:members",
      "package_set_sha256": "sha256:packages",
      "package_targets_sha256": "sha256:targets",
      "feature_definitions_sha256": "sha256:features",
      "workspace_inputs_sha256": "sha256:inputs",
      "compiler_config": {
        "status": "observed",
        "sha256": "sha256:cargo-config"
      },
      "target_coverage": "workspace_all_targets",
      "feature_coverage": "default_features",
      "toolchain": {
        "rustc_version": "rustc 1.85.0",
        "cargo_version": "cargo 1.85.0",
        "host": "x86_64-unknown-linux-gnu"
      },
      "producer": "cargo_check",
      "profile": "cargo_check_v1",
      "producer_version": "rustc 1.85.0",
      "complete": true
    }
  },
  "diagnostic_delta": {
    "baseline_path": "$EXTERNAL",
    "status": "not_comparable",
    "compatible": false,
    "added": [],
    "resolved": [],
    "persisting": [],
    "reasons": [
      {
        "code": "compiler_config_mismatch",
        "dimension": "compiler_config"
      }
    ],
    "limitations": [
      "baseline and current compiler-affecting Cargo configuration differs"
    ]
  },
  "budget": {
    "requested_tokens": 8000,
    "max_bytes": 32000,
    "serialized_bytes": 2000,
    "exceeded": false
  },
  "limitations": [],
  "omissions": []
}
